{
  "assumptions": [
    "The current checked-in `docs/specs/SDD-OBS-001/spec.md` is the candidate under review.",
    "The grill is limited to requirements completeness; the technical plan was consulted only to understand the spec's identity and lifecycle requirements."
  ],
  "blocking_questions": [
    "What exact canonical projection, field set, ordering, and hash procedure define `final_candidate_identity` and `final_changed_surface`? These identities feed plan and evidence binding, but the spec describes them as canonical without defining their exact representation.",
    "What durability guarantee defines a successful `.agent-state` CAS? Specify whether the crash contract includes OS or power loss and, if so, the required write, fsync, and directory-fsync ordering. A lost acknowledged grant-consumption transition could permit a one-shot retry grant to be used again.",
    "Are review rejections counted as a rework cycle if no subsequent builder attempt occurs? Define the counting boundary for rejections that remain unresolved when the observed history ends, so reports produce a deterministic metric."
  ],
  "changed_paths": [],
  "commands": [
    "pwd",
    "rg --files -g 'constitution.md' -g 'spec.md' -g 'plan.md' -g 'design/gate.json' -g 'verification-contract.json' -g '*.md' docs/adr docs/specs/SDD-OBS-001 docs/agentic-sdd",
    "cat docs/agentic-sdd/constitution.md",
    "cat docs/specs/SDD-OBS-001/spec.md",
    "cat docs/specs/SDD-OBS-001/plan.md",
    "cat tooling/agent-harness/schemas/design-result.schema.json",
    "rg -n \"sandbox capability|SANDBOX_CAPABILITY|descendant containment|manual-review|required_manual_reviewer|manual-only|evaluator_first_pass|time_to_independent_pass|environment-blocked\" docs/specs/SDD-OBS-001/spec.md"
  ],
  "findings": [
    "Task-completion freshness, exact-plan evidence binding, manual-review authentication, critical-gate retry authorization, and launch/recovery states have explicit rules and failure outcomes.",
    "The performance contract defines a planner benchmark, but no measured latency target for candidate sealing. The existing fixed time limit and fail-closed outcome still give deterministic behavior."
  ],
  "non_blocking_risks": [],
  "prototype_recommendations": [],
  "recommendation": "Resolve the three questions in the spec before a Spec Grill PASS; no prototype is indicated.",
  "residual_risks": [
    "Without exact candidate and surface identity projections, implementations or future versions may disagree on identity while appearing to satisfy the prose.",
    "Without a defined durability boundary, crash recovery cannot establish that committed one-shot authority remains consumed after all covered failure types."
  ],
  "status": "needs-human",
  "summary": "The spec defines extensive execution and lifecycle rules, but three observable contracts remain underspecified: candidate identity encoding, lifecycle commit durability, and how unresolved review rejections affect the rework metric."
}
